{
  "schema_version": "work-impact-metrics-v0",
  "artifact_id": "HOX-GAUNTLET-001",
  "metrics_generated_at": "2026-06-27T00:00:00Z",
  "proof_ceiling": "CONTROLLED_VALIDATION_PRODUCT_DEMO_ONLY",
  "dataset": {
    "events_total": 12,
    "expected_positive": 4,
    "expected_negative": 8
  },
  "detection_quality": {
    "true_positive": 4,
    "true_negative": 8,
    "false_positive": 0,
    "false_negative": 0,
    "precision": 1.0,
    "recall": 1.0,
    "f1": 1.0,
    "false_positive_rate": 0.0
  },
  "telemetry_coverage": {
    "required_fields_count": 8,
    "present_fields_count": 8,
    "missing_fields_count": 0,
    "coverage_percent": 100.0
  },
  "claim_authority": {
    "claims_scanned": 7,
    "claims_allowed": 1,
    "claims_blocked": 6,
    "block_rate_percent": 85.71
  },
  "proofcard": {
    "required_sections_count": 16,
    "present_sections_count": 16,
    "completeness_percent": 100.0
  },
  "evidence_gaps": {
    "missing_runtime_evidence": true,
    "missing_signal_evidence": true,
    "missing_customer_deployment_evidence": true,
    "missing_human_final_authorization": true,
    "missing_public_runtime_authorization": true
  },
  "work_impact": {
    "files_evaluated_count": 4,
    "numeric_metrics_emitted_count": 26,
    "deterministic_checks_count": 35,
    "validation_commands_count": 9,
    "measurable_output": true
  },
  "boundary": {
    "runtime_proof_claimed": false,
    "signal_proof_claimed": false,
    "customer_deployment_claimed": false,
    "production_readiness_claimed": false,
    "ai_approval_claimed": false,
    "analyst_approval_claimed": false,
    "final_authorization_claimed": false
  }
}
